{
  "archetype": "apothecary",
  "description": "Thin, courteous, and very tired. Keeps his hands where you can see them, which is itself a habit worth noticing.",
  "dialogueStyle": "Over-explains. Offers detail nobody asked for, then hears himself doing it and stops.",
  "factionId": "fac_road",
  "id": "npc_wren",
  "loreRef": {
    "file": "lore/mistfall.md"
  },
  "name": "Aldous Wren",
  "portrait": "portrait_wren",
  "role": "Sells tinctures along the Kelder road. Was, until spring, a clerk of the assessment.",
  "stats": {
    "observation": 7,
    "rhetoric": 4
  }
}
